title,date,content,keywords,url
Winning on the Margins,"January 18, 2024","In a world marked by change and uncertainty, telecom operators have been resilient. As new technologies and competitors emerge—particularly thebig-tech hyperscalers—telcos are adjusting, transforming, and seeing results: revenues are ticking higher. Yet margins haven’t kept pace. From software licensing to labor and energy, costs are up, eating into profits and putting a damper on growth.

To get margins heading north, telcos will need to continue making adjustments, but in a surgical way. They’ll need to focus on levers that cut costs and boost efficiency while keeping performance steady—and then some. It’s a crucial balancing act. But it doesn’t have to be an elusive one.

This year’s telco IT benchmark (TeBIT) study, jointly developed by ETIS—The Community for Telecom Professionals—and Boston Consulting Group, reveals that two of the most promising levers are in plain sight:sustainabilityand process efficiency. The survey, conducted in November 2023 and covering European operators’ IT spending and performance, finds that both are already high priorities. By reducing energy consumption, sustainability programs can reduce energy costs. By cutting process waste—creating faster, leaner, more automated journeys—efficiency projects can also cut costs. When done well, these initiatives help telcos optimize margins while delivering dividends for customers and society.

So how are telcos doing on these two fronts? TeBIT finds each initiative very much a work in progress. But the study also sheds light on where telcos are gaining ground fastest, where they should redouble their efforts, and how certain enablers—likegenerative AI—can accelerate the journey. (See “About the TeBIT Benchmark.”)





On the revenue side, ETIS members continue to show positive, if not electrifying, momentum. Overall, revenues rose 5.3% in 2022, up from a 2.6% increase in 2021. Digital and ICT services, price premiums, and expansion beyond the core—in areas like media, eHealth, and even financial services—all gave the top line a bump.

Yet telcos continue to struggle with EBITDA margins, an indication that they aren’t managing costs and efficiency as well as they’d like. Margins have fallen steadily over the past several years. While the shift hasn’t been dramatic, from a 3.8% increase in 2019 to a 1.5% drop in 2022, the decidedly downward trend is concerning. The more margins are squeezed, the harder it becomes for telcos to fund the transformations and expansions that are integral for thriving in increasingly competitive markets.","margins(6), costs(5), telcos(5), energy(3), tebit(3), operators(2), revenues(2), levers(2), performance(2), study(2), process(2), finds(2), increase(2)",https://www.bcg.com/publications/2024/winning-on-margins-tebit-executive-report
Big Reg Comes for Big Tech. Here’s How to Respond.,"January 17, 2024","As tech firms face a wave of regulation, and the potential for more lawsuits and larger fines, the old strategy of “move fast and break things” is unsustainable.

Regulators are targeting tech companies with more regulation and stringent enforcement across jurisdictions from California to the EU to India.

With more topics being regulated in more ways, tech companies must rethink their compliance strategy to deal with regulation at scale. Their previous approach of focused, dedicated action for specific regulatory issues will no longer work.

To ensure that innovation continues, tech firms must make thisnew approacha part of their innovation cycle, rather than bolting it to existing processes.

This task is given increasing urgency by the rapidly developing regulation of AI.

Regulators are broadening their focus.They are moving beyond privacy and competition to areas such as content moderation (for example, the UK’s Online Safety Act, passed in October), protection of minors (Utah legislation passed in March aims to protect under-16s on social media), and tech companies’ payment activities (the US Consumer Financial Protection Bureau wants to regulate tech firms’ payments businesses and digital wallets).

Regulatory bodies now insist on transparency and accountability.The EU’s Digital Markets Act mandates stringent audits, enhanced transparency reports, and the appointment of a compliance officer by the company’s board—an indication of the heightened accountability expected in the tech industry. All of tech could soon be regulated like the medtech and fintech subsectors, with scheduled reporting and regulatory examination.

The advent of AI is bringing a new wave of regulation.President Biden’s executive order on AI safety and security in November and the EU’s proposed AI Act signal the onset ofa wave of global regulation. Many other jurisdictions around the world are gearing up to introduce similar legislation.

Enforcement and intervention have intensified.The ten largest fines under Europe’s General Data Protection Regulation, totaling approximately €3.8 billion ($4.1 billion), were all levied on tech companies, and cumulative fines under that regulation now exceed €4.4 billion. (See the exhibit.)Enforcement on competition issuesin particular is ramping up. Microsoft had to significantly amend its $69 billion acquisition deal with Activision Blizzard, finalized in October, after regulatory intervention; Adobe abandoned its $20 billion acquisition of Figma at the end of 2023 after declaring there was “no clear path to receive necessary regulatory approvals.”","tech(9), regulation(5), regulatory(5), companies(4), firms(3), fines(3), enforcement(3), protection(3), strategy(2), regulators(2), stringent(2), jurisdictions(2), compliance(2), deal(2), innovation(2)",https://www.bcg.com/publications/2024/how-tech-firms-can-respond-to-increased-regulation
Will Multimodal GenAI Be a Gamechanger for Industry?,"December 19, 2023","Google’s launch of Gemini can be seen as the latest advancement ingenerative AI, highlighting a shift toward multimodality.

At launch, ChatGPT (GPT3.5) revolutionized content production, and subsequent large multimodal models (LMMs) like GPT4 and Gemini have the potential to revolutionize sectors such as manufacturing, e-commerce, and agriculture.

These new LMMs are trained on images and code, rather than on text alone. Gemini adds audio and video, allowing the AI to directly perceive the physical world.

The race is on among tech companies and open source communities to add new modalities that enhance LMMs’ industrial applications.



Such multimodal capability will be transformational for industry, saysLeonid Zhukov, director of the BCG Global AI Institute.

TraditionalAIis constrained by preset rules—users decide what they want the AI to do and train it for that task. While GenAI models break free from this constraint, LMMs go even further. They can take in so many forms of data that they could respond to seemingly unlimited situations in the physical world, including those that users can’t predict, Zhukov explains.

Companies’ current 10-20% efficiency gains from GenAI bots could expand into new domains with LMMs, he says.

And this is just the beginning. “Today’s LMMs can see and hear the world. Tomorrow they could also be trained on digital signals from equipment, IoT sensors, or customer transaction data—to create a complete picture of your enterprise’s health on its own, without explicit instruction,” Zhukov says.

Here are just a few potential industrial applications:

Firms need to prepare to integrate multimodal models. According to Zhukov, leaders should:

BCG Xis the tech build & design unit of BCG.Turbocharging BCG’s deep industry and functional expertise, BCG X brings together advanced tech knowledge and ambitious entrepreneurship to help organizations enable innovation at scale.With nearly 3,000 technologists, scientists, programmers, engineers, and human-centered designers located across 80+ cities, BCG X builds and designs platforms and software to address the world’s most important challenges and opportunities.Teaming across our practices, and in close collaboration with our clients, our end-to-end global team unlocks new possibilities. Together we’re creating the bold and disruptive products, services, and businesses of tomorrow.

The BCG Henderson Institute is Boston Consulting Group’s strategy think tank, dedicated to exploring and developing valuable new insights from business, technology, and science by embracing the powerful technology of ideas. The Institute engages leaders in provocative discussion and experimentation to expand the boundaries of business theory and practice and to translate innovative ideas from within and beyond business. For more ideas and inspiration from the Institute, please visit ourwebsiteand follow us onLinkedInandX (formerly Twitter).

","new(5), world(4), zhukov(4), models(3), tech(3), bcg(3), institute(3), business(3), ideas(3), launch(2), gemini(2), multimodal(2), potential(2), lmms(2), physical(2)",https://www.bcg.com/publications/2023/will-multimodal-genai-be-a-gamechanger-for-the-future
Telcos Show Modest Gains in Curbing Emissions and Helping Customers Curb Theirs,"December 18, 2023","Thetelecommunicationsindustry has a dual role to play in the global effort to reduce greenhouse gas emissions: to lower its own emissions and to support its customers in reducing theirs. This year’s BCG Telco Sustainability Index offers a comprehensive portrait of the progress the industry is making on both fronts.

Compared with the data for 2021, the new data—collected from published reports on a wide range of environmental metrics covering operations in 2022 from 29 major telecom operators around the world—demonstrates that, overall, the industry has made progress in three of the four dimensions we track. Telcos’ commitment to sustainability and to the circular economy and waste management have shown some improvement, though individual companies have achieved mixed progress. The customer enablement dimension still lags the other three, but progress there has been impressive, which bodes well for operators’ revenues and for other companies’ efforts to decarbonize.

In the fourth dimension, which focuses on reducing CO2emissions and energy intensity, results are somewhat poorer than last year’s, for two main reasons. First, most operators have already begun theirdecarbonizationand energy efficiency journeys and gained quick wins in areas such as switching to 100%renewable energy, where available. These initiatives have led to significant reductions in Scope 1 and Scope 2 emissions, but they have also fed a countervailing effect. The considerable increase in demand for telecom services and data traffic across their networks is complicating operators’ efforts to reduce their carbon emissions and energy usage further.

A deeper look at the results reveals where telcos are making gains, where they need to improve, and what challenges and opportunities they face in doing so.

Data traffic over the world’s telecom networks is increasing rapidly, as is pressure from both business and retail customers for progress on key sustainability metrics. As a result, telecom operators are actively seeking ways to meet their sustainability goals, to future-proof their business against the rising costs of energy and of carbon abatement, and to reduce the risks associated withclimate change.

Progress, however, has been mixed. The telecom industry’s overall median score improved by 9 points in 2022 over the previous year. (See Exhibit 1.) But scores on three of the four main dimensions of the index did not show equivalent gains. (See “How We Create the Index.”) Median scores for commitments to sustainability and for circularity and waste management improved by 5 points, while efforts to reduce emissions and emissions intensity actually worsened by 3 points. In fact, the advance in overall score is largely due to a very substantial 24-point gain in customer enablement—and despite this achievement, the industry as a whole still needs to improve in this dimension.","emissions(6), sustainability(5), progress(5), telecom(5), operators(5), energy(5), industry(4), year(3), data(3), overall(3), dimension(3), efforts(3), points(3), customers(2), index(2)",https://www.bcg.com/publications/2023/telcos-modest-emission-reduction-progress
Empowering the Marketing Function in B2B Sales,"December 15, 2023","A growing number of B2B companies are exploring ways to use marketing technology (martech) to bolster their go-to-market activities. Our recent project experience shows that companies that implementdemand centersand then successfully integrate their marketing, sales, and service functions are generating better leads more efficiently, improving their conversion rates, and achieving higher returns on marketing investment.

These initiatives are ensuring that their highly targeted, personalized messaging consistently reaches the right person at the right time. (See Exhibit 1.) By automating the generation of qualified leads, a demand center frees-up time for sales representatives to focus on value-adding activities such as sales conversations and conversions.","sales(3), companies(2), activities(2), leads(2), right(2), time(2)",https://www.bcg.com/publications/2023/empowering-the-marketing-function-b2b-sales
Cloud Cover: Cloud Prices Rise as the Era of Generative AI Dawns,"November 29, 2023","For the first time since the debut of cloud services, prices began to edge up in the first six months of 2023, according to theNimbus Pricing Index(NPI). Many have wondered if inflationary pressures and weaker revenue growth for cloud service providers (CSPs) would eventually lead to price increases. That time seems to have arrived. Although the impact is still marginal in most geographies, the price increases are significant in some European countries.



The NPI, which reflects average pricing in US dollars across the three main CSPs, recorded an average increase of 0.3% per price point (in other words, the price offered by one vendor in one location). The largest single increase was about 2% in South America. (See Appendix 1 for the full NPI table.) We also note that price ranges in some locales nudged upward in the first half of 2023 compared to the second half of 2022.

The four locations in Exhibit 1 are hubs where all three major CSPs have an offering that meets the specifications of the NPI. These modest increases indicate that CSPs continue to look for ways to boost revenue without resorting to direct price-list increases—especially in computing power, which is the largest component of most clients’ cloud billing.","price(5), increases(3), csps(3), time(2), cloud(2), pricing(2), revenue(2), average(2), increase(2), half(2)",https://www.bcg.com/publications/2023/cloud-prices-surge-with-rise-of-genai
Marketing Science Is the Path to Profitability for Subscription Media,"November 27, 2023","The era of “growth at all costs” is over for subscription media companies. Customer growth has slowed, acquisition costs have risen, and churn is way up. These changes impact direct-to-consumer businesses across video streaming, audio, gaming, and publishing. Traditional media companies still transitioning to these models have been especially challenged, since they’re confronting these issues while also trying to keep up with digital native companies that pioneered many of today’s subscription marketing approaches.

Shifting priorities on Wall Street have only added to the pressure. Impatient with heavy losses in new digital subscription business models, investors are increasingly rewarding profits, not just unit growth. Valuations for many media subscription businesses are down substantially, with seven of the top ten streaming media companies in the US underperforming the S&P 500 index by 41% from September 2021 to September 2023.

Media and entertainment leaders know it’s time to pivot. Instead of organizing around revenue growth at all costs, they need to optimize for profitable growth.

Some high-performing businesses have already begun this transition, and they are incorporating precision analytics andartificial intelligence(AI) into theirmarketingcapabilities to improve unit economics. BCG found that these businesses are more successful at identifying—and retaining—high-value customers, with churn rates that are 30% lower than the average. They also excel at marketing efficiency, with nearly 50% breaking even on customer acquisition costs (CAC) within a year, versus the more typical three-to-five-year payback period.

What these companies are doing well, others can emulate, and they don’t need to bite off sweeping changes to do so. Our research and client experience show that targeted shifts can yield significant results, and gains can compound over time as companies expand their capabilities.



Since 2016, the number of video-on-demand services with more than 1 million subscribers globally has quadrupled, from 28 in 2016 to 120 in 2022. During most of that time, subscriber growth also soared. But that’s changed: the top ten biggest streaming platforms saw average acquisition plummet from 51% year-over-year growth in 2020 down to single digits in 2023.

To attract and retain customers in this saturated market, some media companies have leaned hard into content, significantly ratcheting up spending on production and licensing. In 2022 alone, spending on original content jumped by 45%. But this surge has driven down margins and further pressured unit economics. In response, some companies have recently begun to rein in content spending, but there can be peril in that path, too, since cutting quality programming will give customers less reason to stick around and may increase churn.","companies(8), growth(7), media(6), subscription(4), businesses(4), acquisition(3), costs(3), unit(3), time(3), customers(3), content(3), customer(2), changes(2), models(2), digital(2)",https://www.bcg.com/publications/2023/why-subscription-based-companies-need-margin-based-marketing-approaches
A Net Zero Plan for the Semiconductor Industry,"November 07, 2023","Two trends broadly affecting thesemiconductor industrythreaten to significantly increase its carbon emissions from around 0.3% of total global emissions today.

First, demand for chips is accelerating. Virtually every modern industrial and consumer device—from children’s toys to rocket ships, and from the smallest appliance to the biggest automobiles—as well as most daily activities, such as sending an email, ultimately run on semiconductors.

Second, as chips increase in processing power, semiconductor production almost inevitably becomes more carbon intensive. Manufacturing more advanced semiconductors requires ever more complex processes, which consume more electricity and process gases.

If the current growth path were to continue unchecked, carbon emissions from semiconductor production would rise by about 8% annually in coming years and not peak until about 2045.



The need to combat climate change grows more urgent as the Paris Agreement’s goal of limiting the increase in global average temperatures to 1.5°C above preindustrial levels slips away. To do its part, the semiconductor industry must develop a decarbonization plan to reach net zero.

But without a clear picture of semiconductor emissions levels at every stage of chip manufacture and usage, there can be no path to net zero. With that in mind, BCG, SEMI, and the Semiconductor Climate Consortium (SCC) have publishedTransparency, Ambition, and Collaboration: Advancing the Climate Agenda of the Semiconductor Value Chain, a report that offers the most complete analysis of semiconductor-related greenhouse gas (GHG) emissions to date, as well as a detailed analysis of current and future emissions across the semiconductor value chain to facilitate targeted development of abatement solutions.

The research is especially notable for its ambitious range. Not only did we calculate Scope 1 and Scope 2 emissions—essentially, emissions that directly result from semiconductor design and manufacturing activities and from the energy consumed during those operations, respectively—but we also examined Scope 3 emissions. These are upstream CO2 emissions from suppliers’ production and materials sourcing activities as well as downstream emissions from the use of chips by customers in daily applications.



Our research yielded five key findings:



The full report develops and analyzes a series of scenarios for GHG emissions in manufacturing through 2050, charting possible semiconductor industry outcomes against an overall goal of adhering to the 1.5°C pathway. (See the exhibit.) Because data on supply chain and device usage is still difficult to measure and assess, we do not include these activities in our forecasts.","emissions(11), semiconductor(9), activities(4), carbon(3), chips(3), production(3), climate(3), chain(3), scope(3), global(2), daily(2), semiconductors(2), increase(2), manufacturing(2), current(2)",https://www.bcg.com/publications/2023/a-plan-to-reduce-semiconductor-emissions
