title,date,content,keywords,url
"Cloud Transformation, Without the Risk","April 08, 2024","The explosive growth in public cloud computing shows no signs of abating any time soon. Spending with the three largest cloud companies—Amazon, Microsoft, and Google—soared by $148 billion in the past five years, to $211 billion in 2023, a 337% jump. Almost 30% of IT leaders say their companies plan to increase spending on the cloud during the next 12 months,according to a recent BCG survey,and the rise ofgenerative AIwill only boost spending further, with a similar percentage saying they expect to spend more onAIand machine learning, including GenAI.

The logic behind the ongoing gold rush is clear:cloud computingcan be far more efficient and less costly than in-house IT. And it offers the potential for greater flexibility and speed in meeting the changing needs of companies operating in rapidly evolving business environments. Organizations that get the transformation right can lower infrastructure costs by up to 40%, boost productivity by as much as 50%, and accelerate time to market by up to 60%.

Despite the promise of cloud computing,accomplishing a smooth migration isn’t easy. Challenges and pitfalls include a poorly defined scope and design, an ineffective cloud economic model, the difficulty posed by complex legacy infrastructure, and a lack of competence in managing cloud-based technology.

Moreover, many organizations fail to realize that moving to the cloud requires afundamental shift in mindsetaway from a traditional data center model. As a result, many cloud transformation programs fall short of their revenue generation and cost-saving objectives, with materially harmful financial consequences.

Instead, companies must avoid the predictable traps and focus on five factors that can significantly improve their chances of success. Here, we offer a detailed framework for reducing the inherent risks, from the planning stage through to full operation in the cloud. The goal: to ensure that businesses capture the full benefits of cloud computing.

Our experience shows that companies making the transition to the cloud typically fall into one or more of five common traps:

Failure to address any of these challenges promptly can have severe consequences. Increased costs, project delays, and wasted resources can result in significant financial losses. Poor planning and a lack of coordination with business units can mean missed opportunities and dissatisfied customers, eroding companies’ competitive advantage. And failure to ensure a smooth transition could lead to heightened scrutiny from investors and regulators—and even reputational damage. Companies that delay resolution of these challenges can further compound the damage, making course correction even more difficult and costly.

Avoiding the potential pitfalls during a migration to the cloud is critical if companies are to realize the full benefits of cloud computing. While there is no single route to success, organizations can improve their likelihood of a winning transition—and minimize the inherent risks—by taking these crucial steps.

Treating the Transition as a Business Transformation.In practice, a major cloud migration is ultimately a critical lever for transforming the business itself, since operating in the cloud differs significantly from on-premise infrastructure. Yet companies often implement their cloud programs as part of an infrastructure strategy without taking into account the wider business context. Before launching the transition, organizations must establish a vision for the cloud that recognizes and incorporates the principles of speed to value and resilience—rapidly boosting business value by creating a more efficient platform for development teams and accelerating product delivery.

To support the vision, companies must develop a well-defined cloud strategy that clearly articulates the business objectives and clarifies the overall scope of the program. And they need to clearly communicate this across the entire organization. The strategy must be carried out through a well-governed program linked directly to the right tactical decisions—what, when, and how to migrate—to maximize business return on the cloud investment.

Cloud computing requires changes to the business operating model as well as the technology operating model. Successful organizations ensure that their cloud program aims to change the business rather than the other way around. A properly revised and updated business operating model should enable the company to reap the benefits of operational efficiency through greater automation of resource provisioning, monitoring, and management. And it should help the governance and compliance functions conform to internal policies and appropriate regulations while fostering a culture of business model innovation, resilience, and continuous improvement through the cloud’s inherent flexibility.

Adopting a Migration Factory Approach.All too often, companies attempt to reinvent the wheel for every workload type that needs migrating, wasting time and resources. Successful organizations use a factory approach for migrating workloads to the cloud. They have a clear definition and detailed cloud migration and architecture requirements for each workload type—everything from front-office business applications and analytics platforms to complex data integration platforms and legacy systems—and they develop a specific migration pattern for each type.

A factory approach will also allow teams to speed up future application migrations and transformations. The key is to make sure that the process is iterative and follows continuous improvement methodologies. Companies should conduct pilot migration tests to prove each pattern before scaling it for use in parallel across multiple teams. And they should apply lessons learned from ongoing migrations to improve each migration pattern.

Carefully Managing Cloud Consumption.Getting cloud consumption levels right is critical to a successful transition. Companies must be especially careful to manage over-consumption in the cloud. Cloud FinOps, the practice of actively measuring and managing consumption and spending in the cloud, must be embedded into the work practices of all stakeholders. Every team should know the cost implications of its cloud design and engineering decisions. Successful organizations support this by establishing a FinOps function that spans business, technology, and finance to ensure that their investment in the cloud aligns with overall strategic goals and delivers business value.

Under-consumption can sometimes be as big a problem as over-consumption. When companies initiate large cloud programs, they typically establish a commitment to a chosen cloud provider that sets out a target consumption level. If that level isn’t met, they may fail to earn significant discounts, credits, and support. To avoid this, organizations must get the sizing of the consumption target and timeline right in the first place, in light of the cloud transition’s business objectives—and then build an operating model that appropriately manages the target. By developing a reliable cloud infrastructure, dependent on and supported by an efficient developer environment, the technology function can hit its consumption targets and maximize the value gained from the cloud platform.

Maintaining Strict Vendor Managementand Developing Skills In-House.Although third-party involvement is inevitable in any cloud transformation, excessive reliance on outside partners will inhibit the development of the in-house skills needed for a successful cloud transformation and the implementation of the new operating model. To avoid this, companies must oversee their partners and vendors effectively, from the outset, instituting appropriate controls to manage expectations during the transition and once the system is up and running. Internal staff must make all key decisions, and partners should be required to work alongside in-house teams rather than in their own silos. This will prevent any potential risks from over-reliance on partners.

Contracts should be written to ensure that all third parties are held accountable for the successful outcome of the program, and these agreements should be agile in nature rather than written as long fixed-term contracts, which limit scope. Commercial incentives and the sharing of productivity gains among all parties will encourage continuous improvement. Finally, terms should include rigorous program governance mechanisms to track results and confirm that timeline commitments are being upheld.

To promote the development in-house of the skills needed to operate in the cloud, successful organizations focus on three key areas: they hire leaders with experience in successful cloud transformation, develop cloud training programs to cultivate in-house talent, and bring in trusted third-party cloud specialists to work alongside and improve the skills of internal staff.

Establishing a Proactive Program Assurance Capability.Large cloud transformation programs typically include risk and governance functions, but all too often, when needed, these programs intervene too ineffectively and too late. To minimize execution risk, companies should establish a proactive program assurance capability to maximize the value captured through the transition. Effective program assurance allows organizations to anticipate challenges, ensure alignment with goals, maintain quality, and efficiently manage resources.

As we have seen, all major cloud transition programs are risky and fraught with potential pitfalls. Under these conditions, companies have a considerably greater chance of achieving sustained value within budget if they make quality assurance an integral part of the process throughout. In our experience, committing an additional 3% of the overall budget to program assurance can save more than 30 times the cost of any de-risking effort required. (See “A Framework for De-Risking Cloud Transformations.”)



Copy Shareable Link

Companies should follow a consistent, comprehensive approach to assuring the quality of their cloud program throughout the transformation journey:

Early action on the part of company leaders is key to successfully de-risking the transition to the cloud and maximizing the business value to be gained, since these senior executives play a critical role in fostering the most conducive environment for a profitable cloud transformation. To ensure success, CIOs and CTOs as well as their CEOs should make sure to get complete answers to five questions from their cloud transformation team:





To create sustainable value in a cloud transformation, organizations must employ a competent and robust de-risking strategy that addresses the potential causes of failure. There are many different hurdles to be cleared before a satisfactory cloud transformation can be accomplished. But by understanding the common challenges, addressing them early, and following a comprehensive approach, leaders can steer their companies toward successful execution, maximizing the benefits of the cloud and underpinning long-term success.

","cloud(45), companies(18), business(17), organizations(11), transformation(11), transition(10), program(10), successful(9), migration(8), model(8), value(8), programs(7), potential(5), consumption(5), assurance(5)",https://www.bcg.com/publications/2024/cloud-transformation-without-the-risk
Technology’s Central Role in Post-Merger Integration,"March 19, 2024","

This is a modal window.

Beginning of dialog window. Escape will cancel and close the window.

End of dialog window.

Jonathan Milde



Inpost-merger integration, technology issues have become as critical as the traditionally emphasized financial and people considerations. Technology and data platforms are increasingly vital in facilitating the multiyear integration process, accelerating business synergies, and realizing the transaction’s broader ambitions.

Companies that fail to adequately addresstechnologyand data in PMI jeopardize near-term business continuity and impede efforts to achieve the merger’s longer-term objectives, such as promoting competitiveness through efficiency and innovation. They also risk diminishing value for consumers, value chain partners, and investors.

The solution is to move technology to the center of PMI. Although elevating technology's role may seem straightforward, it requires companies to adjust their PMI processes. This begins with establishing joint leadership of integration initiatives across business and technology functions and aligning their strategic priorities. To support integration efforts, companies must institute robust governance and the right operating model and foster a data-driven culture to guide decision making.

By taking these steps, companies have rapidly moved from table stakes, such as maintaining service levels, to value-creating activities, such as transforming products and applying their combined data to boost revenue.

The imperative to emphasize technology in PMI results from two main factors: its criticality throughout the integration process and its enablement of broader enterprise synergies.



Technology and data play essential roles throughout the three horizons of the integration process. (See Exhibit 1.)","technology(7), integration(6), window(4), data(4), companies(4), pmi(4), process(3), business(3), dialog(2), synergies(2), efforts(2), value(2)",https://www.bcg.com/publications/2024/technologys-role-in-the-post-merger-process
Denmark’s GenAI Paradox: From Lagging to Leading,"March 18, 2024","The most extensive Nordic survey to date has been performed to investigate the adoption and application of Generative AI (GenAI) by Danish companies, yielding a comprehensive analysis of how businesses are interacting with and harnessing the power of this innovative technology. Including responses from more than 572 Danish company executives and senior management across all industries and company sizes, the survey presents us with a representative picture of the full Danish industry.

Generative AI (GenAI) represents one of the most significant technological breakthroughs of the modern era. By harnessing the power of large language models and machine learning, GenAI has the potential to fundamentally reshape how businesses operate and deliver value. As an innovation leader, Denmark finds itself at a critical juncture—whether to fully embrace this wave of disruption or risk falling behind global competitors.

Resolving this paradox requires an acceleration in how Danish companies approach GenAI. This report outlines key recommendations for business leaders to take ownership and articulate a bold vision based on different company archetypes identified.","genai(4), danish(4), company(3), survey(2), generative(2), companies(2), businesses(2), power(2)",https://www.bcg.com/publications/2024/state-of-gen-ai-in-denmark
Regulating the Next Generation of Satellites,"March 14, 2024","The use of low-Earth orbit (LEO) satellites is reaching an inflection point, with the potential to transform communication. Compared to traditional satellites, LEO technology offers faster communication and lower latency. The satellites themselves are smaller and less expensive to build and launch—with costs projected to continue falling. Thousands of first-generation LEO satellites are already in orbit, but new versions are coming in greater numbers. They will not replace existing satellites but complement them, creating a hybrid solution that will unlock new uses based on seamless connectivity everywhere on Earth—even in the most remote locations.

Governments—to capitalize on this opportunity—will need to create the right regulatory framework, offering satellite operators a unified set of rules for everything from spectrum allocation to the removal of space debris. The future of satellite technology is promising, but that will only play out with the right level of coordinated support from government.





The global satellite communications market is on track to reach $40 billion to $45 billion by 2030, according to our analysis, up from roughly $25 billion right now. LEOs are expected to contribute roughly 40% of the market at that point, primarily because they offer features that existing satellites do not. Until recently, most satellites’ usefulness has been limited by geostationary orbit (GEO) high above the Earth, offering slow, low-bandwidth connectivity for a small number of applications.

LEO satellites overcome these limits. They orbit at altitudes of 500 to 2,000 kilometers, a shortened distance to Earth that enables higher-speed, lower latency communication. Two pioneering constellations—Starlink and Eutelsat-OneWeb—already have more than 4,500 satellites in orbit, offering speeds of 25 to 150 Mbps and latencies of 25 to 60 milliseconds on land. The satellites launched by these and other players are first-generation LEO satellites that enable such uses as precision farming, fleet management, public transport, and direct-to-cell (D2C) text messaging over mobile phones. (The SOS service on iPhones already uses LEO satellites.)

The range of applications from LEO satellites is going to dramatically expand over the next five to ten years. During that time, the industry will deploy more advanced constellations using even better technology. For example, second-generation LEO satellites will have larger antennas and inter-satellite links (which transfer data directly between satellites) to provide signals that are five times faster than the current satellites and with half the latency and fewer ground stations. These upgrades will spur the development of new consumer and business applications. New players including Amazon Kuiper and Telesat, along with established companies like Starlink and Eutelsat-OneWeb, plan to launch over 45,000 new LEO satellites in total. Google and AT&T jointly invested $155 million in AST SpaceMobile to fund a constellation specifically to compete with established players. Other companies are making similar investments in LEO technology.

Longer term, third-generation satellites already in development plan to carry video calls, video streaming, and other data-rich applications. This massive expansion will enable a broader range of applications—we estimate at least 35 applications across 15 primary sectors, ranging from satellite-enabled broadband in remote areas to automotive connectivity, disaster response, wearable health-care solutions, and AR/VR applications. Collectively, those applications will create up to $20 billion of market value by 2030. (See Exhibit 1.)","satellites(11), applications(7), leo(6), new(5), technology(4), communication(3), latency(3), connectivity(3), satellite(3), market(3), players(3), orbit(2), point(2), uses(2), remote(2)",https://www.bcg.com/publications/2024/regulating-the-next-generation-of-satellites
How Telcos Can Find the Right Balance in the Cloud,"February 28, 2024","Pilots have a phrase to rank priorities in a crisis: “Aviate, navigate, communicate.” Iftelecom companieshad a phrase, to guide them through today’srapidly evolving landscape, it would be, “Innovate, innovate, innovate.” To get ahead, telcos must focus on what matters most: creating unique and differentiating products and experiences. But can they truly do this when they are dedicating significant resources—as much as 5% of revenues—to a technology space that potential partners have already mastered?

Today, many operators are steering scarce time, talent, and funding into creating a private telco cloud—and to be sure, a cloud suitable for telco workloads is essential. Future networks will be based on full virtualization. They will leverage commercial off-the-shelf (COTS) hardware, incorporate new features through unified API, and employ AI—includinggenerative AI—for automation, optimization, and orchestration. These functions are the cloud’s stock-in-trade. Little wonder, then, that new network technologies such as 5G standalone and emerging standards such as open radio access network are accelerating the move to cloud-based architecture.

Yet taking cloud development private—which might have been the right call a half-decade or so back—is no longer the optimal path for many telcos. In most cases, creating a private telco cloud has proven to be more expensive and difficult than companies expected. Operators often find themselves tackling more integrations and greater complexity than they bargained for, inviting a rethink of their approach. But while telcos see the shift to the cloud as important, they don’t tend to see it as urgent. So rethinks and changes stay on the backburner.

Meanwhile, hyperscalers—the large public cloud providers—have worked to reduce concerns about data privacy, regulatory compliance, and other risks. And critically, the public cloud can be less public than was formerly the case. Today, telcos can deploy hyperscaler infrastructure on their own premises.

Getting the telco cloud right is no longer a matter of public versus private. It’s a question of balance: making savvy choices on what to build and what to buy, and ensuring that compromises favor speed and agility in developing new products. Striking that balance begins with clearly identifying the company’s business objectives and understanding the true price and competitive benefits of developing a telco cloud. It also entails seeing cloud in a new light: not simply as a route to lower cost of ownership, but as a lever for maintaining a focus oninnovation—creating services and business models that create value.

Most telcos view hyperscalers as playing a supporting role rather than a starring one in their operations. To a large extent, public cloud use revolves around running IT workloads, including the business support system (BSS) and the operating support system (OSS). Network functions—a telco’s bread and butter, making up 70% to 80% of its total workload—account for a very small share of activity. (See Exhibit 1.)","cloud(10), telco(6), public(5), new(4), today(3), private(3), network(3), telcos(3), business(3), products(2), many(2), operators(2), large(2), balance(2), support(2)",https://www.bcg.com/publications/2024/how-to-find-the-right-balance-in-the-telco-cloud
A New Formula for Success,"February 23, 2024","A quick look at the top-ranked companies in our 2024 Telecommunications Value Creators Report shows varied routes to success. Nevertheless, some strategies appear repeatedly. Top-ranked companies have typically defended their core business, invested wisely in network upgrades, tightly controlled costs, and begun harnessing the power of AI.

In the five years from 2019 to 2023, the telcos in our survey delivered a median annualized total shareholder return (TSR) of 6%, up from 3% for the five-year annualized TSR we reported 12 months ago.

But before they break out the champagne, telcos should consider some critical context. From 2019 to 2023, the S&P 1200 index of global stocks had an annualized TSR of 13%, meaning that thetelco industryperformed below the market average. In fact, for the most recent five-year period, telcos ranked 31st among the 33 sectors we track.

A closer examination of the data reveals the industry’s challenges, which include stagnant (and sometimes declining) revenue, and patchy returns from a very substantial investment in 5G.

Telcos’ utility-like characteristics translate into relatively stable returns. As a result, in years (such as 2023) when cross-market returns are strong, telco returns fall short of the average, but in challenging years (such as 2022) they outperform most other sectors. (See Exhibit 1.)","telcos(4), years(3), returns(3), companies(2), tsr(2), average(2), sectors(2)",https://www.bcg.com/publications/2024/new-formula-for-success
