title,date,content,keywords,url
How Retail Media Can Top the CMO Agenda,"June 11, 2024","The globalmedialandscape has undergone a huge transformation over the past few years, driven by exciting new technologies and shifts in consumer behavior. Innovations such as digital streaming, social media, andgenerative AIhave received a great deal of attention from chief marketing officers, while retail media—another exciting emerging channel—has gone relatively unnoticed. Although retail media has been shaking up marketing practitioners’ day-to-day activities for some time, it has not enjoyed the same level of interest from the C-suite.

Retailmedia deserves better. With the proliferation of media channels, it has never been easier for companies to reach consumers. But with the fragmentation of audiences, it has never been more difficult to engage them. Retail media has the potential to revolutionize how brands speak—and engage—with consumers, making it a powerful strategic tool in marketers’ arsenal.

Consider one possible scenario. A beverage maker launches a new energy drink. The brand works with itsretail media network(RMN) partner —such as Walmart Connect or Target’s Roundel—to reach energy drink consumers on social media (using advanced analytics on previous purchases to select the target audience) and offer them a first-time purchase coupon in the retailer’s loyalty app. When a consumer next visits one of the retailer’s outlets, in-store digital screens encourage them to check the app to see if they have received a special offer. Once the consumer has redeemed the coupon to buy the drink, they are given a “streak” offer or a bulk-buy discount to build long-term loyalty—reinforced by advertisements both in-store and on their mobile devices.

This example shows how the tools of retail media can drive sales and build brand loyalty across multiple channels. Currently, however, retail media is far from this potential. Meanwhile, brands have nearly tapped out the shopper marketing and trade budgets largely funding retail media’s growth to date. And brands are reluctant to turn to other funding sources without a step change in retail media and its results.

To discover what’s needed to unlock additional brand dollars, we interviewed industry leaders from both brands and retail media networks and surveyed over 100 brand marketers and their agencies.

Our findings showed that, to secure brands’ continued support, RMNs will need to take retail media to the next level—Retail Media 3.0—by offering advertisers far more than they do today. Specifically, half of the brands we contacted are looking for retailers to offer data and insights in a way that they have never received from their traditional partners, the retailers’ merchandising departments. But media excellence—including programmatic ad buying and real-time reporting—will need to become table stakes as retail media competes squarely in the digital advertising market.

For years, major advertisers, particularly consumer packaged goods companies, have struggled with being disintermediated from a direct relationship with their consumers by retailers. This has created two groups: the “Data Haves” (retailers) and the “Data Have Nots” (brands). Historically, that disparity has been mediated by 3P cookies, which have enabled targeted advertising without 1P data. But with third-partycookie deprecation, this fragile equilibrium is already being disrupted. Retailers need to flip the script on data. Rather than hoarding it, retailers need to share data-driven insights with brands to allow the ecosystem overall to thrive and grow. Retail media is the vehicle for achieving that.

Retail media networks enable brands to buy advertising space across the retailer’s owned channels (such as its website, mobile app, or in-store screens) and paid media (with RMNs using first-party data to target relevant audiences across programmatic display ads, search, or social media). With either approach, RMNs use data and access to the consumer purchase journey to connect with consumers, measure the impact of the advertising that reaches them, and provide these measurements to the brands.

Retail media networks have gained favor among brands because they provide an effective route not only to target consumers but to engage with them at critical moments during theconsumer journey. Furthermore, RMNs’ closed-loop measurement capabilities enable companies to gauge how successful media campaigns are at generating sales, which as any CMO or CFO will tell you is the holy grail of marketingmarketing.

Within the next two to three years, the US retail media market is projected to be over $100 billion in revenues, more than three times the amount in 2021. Out of the additional market value that is expected to be created in this period, about two-thirds will be net new spending with retailers over and above historical trade dollars. About one-third will come from brands shiftingexisting budgets. However, getting to these projections will depend on retailers upping their game. If they want to capture the new money on the table and demonstrate real value creation and return on investment, Retail Media 3.0 will need to be an essential part of the strategy and have the buy-in of the CMO.","media(23), retail(14), brands(11), retailers(8), consumers(6), consumer(5), data(5), new(4), brand(4), target(4), years(3), digital(3), social(3), marketing(3), channels(3)",https://www.bcg.com/publications/2024/driving-brand-success-with-retail-media-innovation
Generative AI: The Middle East CIO’s Newest Value Creator,"June 05, 2024","Generative AI (GenAI) is triggering disruption across industries, generating debate and exploration at all levels of private and public organizations, all the while moving at a rapid pace with maturing use cases.",,https://www.bcg.com/publications/2024/generative-ai-the-middle-east-cios-newest-value-creator
Closing Tech’s Gender Gap in Southeast Asia,"May 31, 2024","Technologyis transforming economies and societies throughout Southeast Asia, but the tech sector’s gender imbalance persists.

To understand this disparity—and identify potential solutions—BCG partnered with Singapore’s Infocomm Media Development Authority to conduct a comprehensive survey of about 4,000 individuals across six Southeast Asian countries: Indonesia, Malaysia, the Philippines, Singapore, Thailand, and Vietnam. We also interviewed more than 30 women in tech across the region. (This is a follow-up to a 2020 report we published on thegender disparity in tech in the region.)

Our analysis finds that the current state of gender diversity in technology across Southeast Asia is mixed:

Our research identifies underlying issues across four key moments of truth in a woman’s technology career, including in both technical roles—particularly those requiring deep expertise (such as software engineer)—and leadership positions.

Choosing to Study Technology.The decision to pursue a technology degree sets the stage for a future career in the tech industry. Our data reveals a wide variance across countries in the proportion of women enrolled in tech-related courses, from 36% in the Philippines to 58% in Malaysia. Our survey finds that early exposure to technology is important at this key moment: Gen-Z women who were exposed to technology before their university enrollment are 27% more likely to pursue a tech-related degree.

Embarking on a Technical Career.At this critical juncture, a noticeable gap exists: women constitute less than 30% of the applicants for entry- and executive-level technical positions across the six Southeast Asian countries. Furthermore, less than half of women graduates with tech-related degrees—a natural pool of talent for technical roles—choose to enter such roles. Our survey reveals that the prevailing perceptions of technical roles, such as being dominated by men and lacking work-life balance, are deterring women. Moreover, many women tend to lose interest in technology while pursuing a higher education.

Staying in a Technical Role.Nearly half of women respondents who are currently in a technical role are considering shifting to a nontechnical role. Across the six Southeast Asian countries, the primary factor for this change is salary, but many women also reported feeling stifled by the lack of a clear career path and a workplace culture that seems indifferent to the unique challenges they face. For instance, 32% of women in technical roles feel that their day-to-day work experience is not free of bias.

Advancingto Senior Leadership.The fourth and final moment of truth is advancing to a position of senior leadership. In these Southeast Asian countries, women account for only 23% of senior leaders in the top 50 tech companies, with just 8% in technical leadership roles. At this juncture, there’s a perception of subjective performance evaluations, with 30% of women in technical roles feeling that career-related decisions, such as promotions and stretch assignments, are not free of bias. However, having mentors and role models can help bridge this gap: women in technical roles are twice as likely to be promoted faster than their peers if they have a woman mentor.

Many entities—including industry associations and governments—already support women with some baseline initiatives, including recruiting, mentoring, networking, and outreach programs to boost retention. While those are valuable and should continue, we feel that the additional steps below should be priorities.","women(14), technical(11), southeast(6), technology(6), roles(6), tech(5), countries(5), asian(4), survey(3), career(3), leadership(3), many(3), role(3), senior(3), asia(2)",https://www.bcg.com/publications/2024/closing-gender-gap-in-technology-in-southeast-asia
Why Video Streamers Need to Rebundle,"May 29, 2024","The advent of video streaming enabled consumers to break free from the longstanding pay TV model, when subscribers paid a flat fee for 150+ channels. Today, consumers can choose from among subscription video on demand (SVOD) services like Netflix, Amazon Prime, Hulu, Disney+, Max, Paramount+, Peacock, and dozens of smaller services. Recently, Disney, Fox, and Warner Brothers Discovery announced a new sports “skinny bundle.” And a bundle with Peacock, Netflix, and Apple TV+ for Comcast subscribers will add even more choice.

The problem for media companies is that the pay-as-you-go streaming model is far less profitable than the big-package model. A primary reason is high churn. The flat-fee TV bundle had high switching costs for consumers, both because unsubscribing meant losing access to essentially all TV content and they often needed to schedule a service call or return set-top boxes to a local retail store.

Streaming, by contrast, has much lower switching costs. Consumers finish their favorite series, click a few buttons to disconnect, and sign up again the next time there is a buzzy show. According tomedia industryanalysts Antenna, the average churn for “premium” streaming services was 5.5% as of January 2024. That implies an average customer life of just under 20 months. Coupled with high acquisition costs, this makes it extremely difficult for content providers to be profitable.

Instead, for sustainable growth and profitability, streaming companies need to be willing to reimagine their business models—again. In fact, they need to rebundle creatively. In practice this means focusing on two approaches: comprehensive streaming bundling, joining forces with other companies to offer multiple streams of content, and multi-product bundling, which provides a range of services—not just streaming TV—at attractive price points.

Media providers’ attempts to combat churn, such as by investing heavily in content and introducing discounts for yearly subscriptions, have not helped much. As an example, according to Antenna, Peacock’s monthly churn has fluctuated in a narrow band between 5.5% and 8.5% since January 2023, despite the service spending significant money on sports and original content. There is a risk that churn is becoming an ingrained consumer behavior as more people use it to manage their monthly entertainment budgets.

There are several reasons for this high churn rate. For one thing, increased competition has generated so much new and exclusive content that many viewers have become inured to it—if they can even find the content in the proliferation of SVOD options. Also, streaming services are not only competing with each other and linear TV but with other forms of media, such as podcasts, gaming, and short-form video, for the time and attention of consumers.

To overcome these challenges, media companies have experimented widely with bundles in recent years. Warner Brothers Discovery offers Max and Discovery+ together. Disney+ can be bundled with Hulu and ESPN+. Verizon customers can access discounted, ad-supported versions of Max and Netflix. Charter subscribers receive ad-supported Disney+ at no additional cost.

However, consumers have not adopted these mini-bundles in large enough numbers to substantially move the needle on churn. For example, when bundled, Hulu’s churn as of December 2023 was 3.7%. However, just 15% of Hulu’s total subscribers chose a bundled option, and as a result Hulu’s overall churn was 5.4%, almost identical to the churn of its unbundled subscribers. (See Exhibit 1.)

As currently conceived, today’s bundles aren’t working. A successful bundle will yield either better unit economics on existing subscribers (through lower churn or lower customer acquisition costs) or a pathway to acquiring new subscribers. Hitting this mark will require the industry to be bolder.","churn(9), subscribers(7), content(7), consumers(6), services(4), hulu(4), media(4), companies(4), high(4), video(3), model(3), peacock(3), new(3), costs(3), today(2)",https://www.bcg.com/publications/2024/why-video-streamers-need-to-rebundle
Advanced Packaging Is Radically Reshaping the Chip Ecosystem,"May 20, 2024","Periodically, analysts commenting on the chip industry will pronounce that Moore’s Law is obsolete. Yet while the speed of progress is slowing down, chipmakers are still doubling the number of transistors on an integrated circuit (IC) approximately every 2.5 years. In the past, fundamentally new approaches for chip design never seemed to catch on. That’s no longer the case as fresh ideas that are essential for running some of today’s most important applications are rapidly gaining favor.",chip(2),https://www.bcg.com/publications/2024/advanced-packaging-is-reshaping-the-chip-industry
The Art of Scaling GenAI in Software,"May 17, 2024","Generative AI(GenAI) is transforming software development. Not only is the technology changing the way code can be written, but it’s also reshaping every stage of the development life cycle—from requirement gathering, system design, and solution development to user experience design, testing, and deployment. When rolled out at scale, GenAI will shift the quality, velocity, and economics of innovation, which may result in a strategic inflection point in the industry.

However, many software companies are finding it difficult to produce results from GenAI tools. They’re struggling to get their development teams to adopt them; and even if they use them, they haven’t figured out how to capitalize on the productivity gains. Several deeply entrenched factors—such as developers’ comfort with existing tools and inexperience with GenAI, the difficulties of managing organizational change, and structural impediments such as legacy code bases and the steep learning curve—prevent these firms from fully capitalizing on GenAI’s benefits.

In this article, we answer the tough questions about GenAI in software development. We show that companies have to go beyond merely deploying GenAI-based coding assistants and transform their organizations if they want to unlock the full value the new technology affords. Specifically, a software firm must create an effective learning journey, manage change carefully, alter its ways of working, and rethink the product development life cycle to optimize GenAI’s benefits. Our learnings stem from the software industry, but our experience shows that they apply to companies in any sector and in any function.

GenAI is creating a lot of buzz, but its use isn’t as widespread as the hype would suggest. Three complications prevent companies from deploying it. (See Exhibit 1).","genai(6), development(6), software(5), companies(4), technology(2), code(2), life(2), design(2), experience(2), industry(2), tools(2), change(2), benefits(2)",https://www.bcg.com/publications/2024/the-art-of-scaling-genai-in-software
Women Leaders in Tech Are Paving the Way in GenAI,"May 14, 2024","Generative AI(GenAI) is proliferating rapidly, and C-suite executives across industries expect that, on average, 46% of workers will need to be reskilled in the next three years as a result. In thetechnology industryspecifically, our new BCG survey shows that 55% of workers across various roles think that GenAI will be critical to their job success.

Women have historically been less likely to adopt new technologies than men have, especially in the early days. For instance, a 2020 YouGov report found that less than 40% of early tech adopters among consumers were women. If the adoption of GenAI follows a similar trend, there is a risk that the gender gap in the tech industry will widen further, asfewer than 30% of middle managers and senior leaders in tech today are women. Now more than ever, companies need to be hyperfocused on proactive measures that minimize and ultimately reduce this gap.

To determine if there are gender differences in adopting GenAI and if so, the root causes and the paths to a resolution, BCG conducted a global survey of more than 6,500 women and men employees in tech companies across seniority levels and functions. In addition, 15 women leaders in the tech industry provided their insights and views on a pathway forward. (See the sidebar “Our Methodology.”)

BCG’s global GenAI survey reached out to more than 6,500 women and men employees across four seniority levels and eight functions in the technology industry. The tech companies surveyed are located in five countries. (See the exhibit.)







In contrast to historical trends, women respondents to BCG’s tech industry survey are generally on a par with their men peers in terms of GenAI adoption. In fact, 68% of women in the industry said they use a GenAI tool at work more than once a week, compared with 66% of men.

However, we found significant differences by seniority and function.","women(8), genai(6), men(5), industry(5), bcg(4), survey(4), tech(4), companies(3), seniority(3), workers(2), new(2), early(2), gap(2), leaders(2), differences(2)",https://www.bcg.com/publications/2024/women-leaders-in-tech-are-paving-the-way-in-genai
Secrets to Scaling GenAI in Information Services,"May 13, 2024","For traditional information services providers,generative AI(GenAI) represents an unprecedented opportunity to drive sustainable advantage. By scaling solutions that leverage their vast data and content assets, companies can help their customers harness the power of GenAI while generating new revenue for themselves. Leading players across financial information, credit, publishing, and other info services are already beginning to see the benefit of GenAI at scale.

But for the vast majority of companies, realizing the full potential of GenAI has proved challenging. According to a recent BCG cross-industrysurvey, 66% of leaders are ambivalent or dissatisfied with their progress on AI and GenAI. This has also been the case with information service providers, many of whom have created proofs of concept only to find that developing a customer-facing product is more costly and resource-intensive than anticipated. Issues pertaining to accuracy of GenAI output, organizational capability and capacity, systems integration, and data preparation are among those standing in the way of successful scaling.

Providers that address these challenges and scale GenAI successfully will have access to a rapidly growing market. According to BCG analysis, the current market opportunity for GenAI financial services information products alone is around $5 billion to $6 billion and is projected to grow to $15 billion by 2026.

To date, GenAI has gained wide use as a way for companies to enhance internal productivity, and some are already using it to drive end-to-end transformation. But for companies that provide information products—such as financial, business, andsustainabilitydata—GenAI can be a tool to enhance the productivity of end-customers. This new revenue stream can help to justify early investments into the nascent technology.

While most traditional info service providers understand the value of this opportunity, few have managed to scale GenAI successfully. To learn why, in early 2024 we surveyed 100 professionals from providers who had experience scaling GenAI solutions. (See “About the Survey.”)

More than half of the survey respondents said that building GenAI products has been more time-intensive and costly than anticipated. Four challenges were cited most frequently: accuracy requirements, organizational capability or capacity, systems integration, and data preparation and management. (See Exhibit 1.)

In early 2024, BCG conducted a survey of 100 tech, data, and IT professionals from global information services providers across financial information; credit, risk, and compliance; business information; and other verticals. Of these respondents, 66 were considered experienced: they have started to or have successfully scaled a GenAI solution. The remaining 34 are considered inexperienced because they have conducted proofs of concept or pilots but have not yet attempted to scale a solution.","genai(12), information(8), providers(6), services(4), data(4), companies(4), financial(4), scale(4), opportunity(3), bcg(3), early(3), traditional(2), drive(2), solutions(2), vast(2)",https://www.bcg.com/publications/2024/secrets-to-scaling-genai-in-information-services
